{
  "$schema": "http://json-schema.org/draft-07/schema#",
  "$id": "Key-Management.json",
  "type": "object",
  "additionalProperties": false,
  "properties": {
    "$schema": {
      "$ref": "defs.json#/definitions/Schema"
    },
    "Name": {
      "type": "string",
      "description": "Unique identifier of the method"
    },
    "Implementation Support": {
      "$ref": "defs.json#/definitions/Implementation-Support"
    },
    "IPR Policy": {
      "$ref": "defs.json#/definitions/IPR-Policy"
    },
    "Specification": {
      "$ref": "defs.json#/definitions/Specification"
    },
    "Infrastructure for Key Resolution": {
      "allOf": [
        {
          "$ref": "defs.json#/definitions/Filter"
        },
        {
          "description": "Is there any infrastructure required to resolve keys and/or validate identifier to key binding?"
        }
      ]
    },
    "Key Rotation": {
      "allOf": [
        {
          "$ref": "defs.json#/definitions/Filter"
        },
        {
          "description": "Can the key referred to in a credential be replaced by another key?"
        }
      ]
    },
    "Key History": {
      "allOf": [
        {
          "$ref": "defs.json#/definitions/Filter"
        },
        {
          "description": "Is it possible to retain and obtain the history of keys related to a certain identifier? In case of key rotation it is important for signed credentials to request older keys that are not used for signing anymore"
        }
      ]
    },
    "Party": {
      "type": "array",
      "items": {
        "enum": ["issuer", "holder"]
      },
      "description": "What party may uses this technique?",
      "$comment": "We are not looking at verifiers here, since e.g. the identification of the verifier is not part of the credential comparison matrix"
    }
  },
  "required": ["$schema", "Name"],
  "title": "KeyManagement"
}
